{
  "schemaVersion": 1,
  "protocolVersion": 1,
  "sessionId": "0198f0f0-7e65-7f72-9c3e-95b59eeb72a9",
  "profileId": "chinese",
  "expected": {
    "packageId": "voice.chinese.funasr-nano-q8.darwin-arm64",
    "providerId": "autobyteus.voice.funasr-nano-q8",
    "modelId": "fun-asr-nano-gguf-q8",
    "languageMode": "zh",
    "platform": "darwin",
    "architecture": "arm64",
    "descriptorSha256": "aaaaaaaaaaaaaaaaaaaaaaaaaaaaaaaaaaaaaaaaaaaaaaaaaaaaaaaaaaaaaaaa",
    "fileManifestSha256": "bbbbbbbbbbbbbbbbbbbbbbbbbbbbbbbbbbbbbbbbbbbbbbbbbbbbbbbbbbbbbbbb",
    "capabilityDigest": "cccccccccccccccccccccccccccccccccccccccccccccccccccccccccccccccc"
  }
}
